<?xml version="1.0" encoding="UTF-8"?>
<trains xmlns:xsi="http://www.w3.org/2001/XMLSchema-instance" xsi:noNamespaceSchemaLocation="Trains.xsd">
  <train no="">
    <train-name>train-name</train-name>
    <from>from</from>
    <to>to</to>
    <journey-info>
      <station no="">
        <name>name</name>
        <arrival-time>arrival-time</arrival-time>
        <departure-time>departure-time</departure-time>
      </station>
    </journey-info>
  </train>
</trains>
